{
  "$schema": "../schema/scenario.schema.json",
  "fixtureVersion": 1,
  "id": "UI-15",
  "title": "截图识字为空时不假装看到证据",
  "allDataFictional": true,
  "frozenClockUtc": "2030-01-02T03:04:05Z",
  "input": {
    "description": "",
    "screenshotProvided": true,
    "screenshotSource": null,
    "mockOcrText": ""
  },
  "system": {
    "windowsVersion": "Windows Fixture Edition 24H2",
    "architecture": "x64",
    "surface": "Desktop",
    "codexVersion": "0.99.7-fixture",
    "codexIsRunning": true,
    "possibleDuplicateInstall": false,
    "sanitizedInstallHints": ["<SANITIZED_INSTALL_HINT>"]
  },
  "doctor": {
    "autoRun": true,
    "behavior": "exit",
    "durationMs": 120,
    "exitCode": 0,
    "stdoutJson": {
      "schemaVersion": 1,
      "generatedAt": "2030-01-02T03:04:05Z",
      "overallStatus": "ok",
      "codexVersion": "0.99.7-fixture",
      "checks": {}
    },
    "expectedState": "Ok",
    "rawOutputMustNotPersist": true
  },
  "issueSearch": {
    "succeeded": true,
    "submittedStableTerms": [],
    "issues": []
  },
  "expected": {
    "category": "Unknown",
    "confidence": "CannotDetermine",
    "resultPageReached": true,
    "blockingConsentPrompts": 0,
    "mustContain": [
      "没有从这张截图里读到足够的文字",
      "不能把它当成正常",
      "刚才更像是哪一种情况？"
    ],
    "mustNotContain": ["已经确定根因", "Codex 没问题", "只有你遇到"],
    "safeActionIds": ["retry_check", "save_materials"],
    "forbiddenActions": ["delete_codex_data", "delete_sessions", "upload_screenshot", "call_openai_api"],
    "publicExport": {
      "allowedAfterReview": true,
      "screenshotIncluded": false,
      "rawDoctorIncluded": false,
      "privateTemporaryMaterialSeparated": true
    }
  }
}
