{
  "$schema": "../schema/scenario.schema.json",
  "fixtureVersion": 1,
  "id": "UI-05",
  "title": "当前 Codex 不支持官方体检",
  "allDataFictional": true,
  "frozenClockUtc": "2030-01-02T03:04:05Z",
  "input": {
    "description": "我说不清具体哪里不对，请帮我检查一下。",
    "screenshotProvided": false,
    "screenshotSource": null,
    "mockOcrText": ""
  },
  "system": {
    "windowsVersion": "Windows Fixture Edition 24H2",
    "architecture": "x64",
    "surface": "Cli",
    "codexVersion": "0.10.0-fixture-old",
    "codexIsRunning": false,
    "possibleDuplicateInstall": false,
    "sanitizedInstallHints": ["<SANITIZED_CLI_INSTALL>"]
  },
  "doctor": {
    "autoRun": true,
    "behavior": "exit",
    "durationMs": 90,
    "exitCode": 2,
    "stdoutText": "",
    "stderrText": "error: unexpected argument '--json' found (fictional fixture)",
    "expectedState": "Unsupported",
    "rawOutputMustNotPersist": true
  },
  "issueSearch": {
    "succeeded": true,
    "issues": []
  },
  "expected": {
    "category": "DoctorFailure",
    "confidence": "CannotDetermine",
    "resultPageReached": true,
    "blockingConsentPrompts": 0,
    "mustContain": ["官方体检在这个版本暂不可用", "这不足以解释当前故障", "仍然完成了其他检查"],
    "mustNotContain": ["应用失败", "已经确定根因", "Codex 没问题", "必须升级才能继续"],
    "safeActionIds": ["check_updates", "save_materials"],
    "forbiddenActions": ["delete_codex_data", "delete_sessions", "edit_codex_settings", "reset_login", "reinstall_codex", "change_network", "submit_github_issue", "upload_screenshot", "call_openai_api", "rerun_doctor_automatically"],
    "publicExport": {
      "allowedAfterReview": true,
      "screenshotIncluded": false,
      "rawDoctorIncluded": false,
      "privateTemporaryMaterialSeparated": true
    }
  }
}
