{
  "$schema": "../schema/scenario.schema.json",
  "fixtureVersion": 1,
  "id": "UI-02",
  "title": "用户只说一句中文描述",
  "allDataFictional": true,
  "frozenClockUtc": "2030-01-02T03:04:05Z",
  "input": {
    "description": "上一个任务做到一半突然断开了，点继续一直恢复不了。",
    "screenshotProvided": false,
    "screenshotSource": null,
    "mockOcrText": ""
  },
  "system": {
    "windowsVersion": "Windows Fixture Edition 24H2",
    "architecture": "x64",
    "surface": "Desktop",
    "codexVersion": "0.99.7-fixture",
    "codexIsRunning": true,
    "possibleDuplicateInstall": false,
    "sanitizedInstallHints": ["<LOCAL_APP_INSTALL>"]
  },
  "doctor": {
    "autoRun": true,
    "behavior": "exit",
    "durationMs": 380,
    "exitCode": 0,
    "stdoutJson": {
      "schemaVersion": 1,
      "generatedAt": "2030-01-02T03:04:05Z",
      "overallStatus": "ok",
      "codexVersion": "0.99.7-fixture",
      "checks": {}
    },
    "expectedState": "Ok",
    "rawOutputMustNotPersist": true
  },
  "issueSearch": {
    "succeeded": true,
    "issues": []
  },
  "expected": {
    "category": "TaskRecovery",
    "confidence": "PossiblyRelated",
    "resultPageReached": true,
    "blockingConsentPrompts": 0,
    "additionalQuestions": 0,
    "mustContain": ["任务恢复", "可能有关", "暂未找到足够相似的问题", "不要删除会话或本地数据"],
    "mustNotContain": ["已经确定根因", "100%", "Codex 没问题", "请填写完整表格"],
    "safeActionIds": ["restart_codex", "preserve_local_data", "save_materials"],
    "forbiddenActions": ["delete_codex_data", "delete_sessions", "edit_codex_settings", "reset_login", "reinstall_codex", "change_network", "submit_github_issue", "upload_screenshot", "call_openai_api"],
    "publicExport": {
      "allowedAfterReview": true,
      "screenshotIncluded": false,
      "rawDoctorIncluded": false,
      "privateTemporaryMaterialSeparated": true
    }
  }
}
