{
  "$schema": "../schema/scenario.schema.json",
  "fixtureVersion": 1,
  "id": "UI-18",
  "title": "用户说 Codex 反复自己退出",
  "allDataFictional": true,
  "frozenClockUtc": "2030-01-02T03:04:05Z",
  "input": {
    "description": "Codex 最近反复自己关掉，重新打开后过一会儿又退出了，正在做的任务也被打断。",
    "screenshotProvided": false,
    "screenshotSource": null,
    "mockOcrText": ""
  },
  "system": {
    "windowsVersion": "Windows Fixture Edition 24H2",
    "architecture": "x64",
    "surface": "Desktop",
    "codexVersion": "0.99.7-fixture",
    "codexIsRunning": false,
    "possibleDuplicateInstall": false,
    "sanitizedInstallHints": ["<SANITIZED_INSTALL_HINT>"]
  },
  "doctor": {
    "autoRun": true,
    "behavior": "exit",
    "durationMs": 390,
    "exitCode": 0,
    "stdoutJson": {
      "schemaVersion": 1,
      "generatedAt": "2030-01-02T03:04:05Z",
      "overallStatus": "ok",
      "codexVersion": "0.99.7-fixture",
      "checks": {}
    },
    "expectedState": "Ok",
    "rawOutputMustNotPersist": true
  },
  "issueSearch": {
    "succeeded": true,
    "issues": []
  },
  "expected": {
    "category": "DesktopApplication",
    "confidence": "PossiblyRelated",
    "resultPageReached": true,
    "additionalQuestions": 0,
    "mustContain": ["桌面应用异常", "可能有关", "不要删除"],
    "mustNotContain": ["已经确定根因", "100%", "Codex 没问题"],
    "safeActionIds": ["restart_codex", "preserve_local_data", "save_materials"],
    "forbiddenActions": ["delete_codex_data", "delete_sessions", "edit_codex_settings", "reset_login", "reinstall_codex", "change_network", "submit_github_issue", "upload_screenshot", "call_openai_api"],
    "publicExport": {
      "allowedAfterReview": true,
      "screenshotIncluded": false,
      "rawDoctorIncluded": false,
      "privateTemporaryMaterialSeparated": true
    }
  }
}
