{
  "$schema": "../schema/scenario.schema.json",
  "fixtureVersion": 1,
  "id": "UI-13",
  "title": "普通设置菜单截图不产生公共搜索词",
  "allDataFictional": true,
  "frozenClockUtc": "2030-01-02T03:04:05Z",
  "input": {
    "description": "",
    "screenshotProvided": true,
    "screenshotSource": null,
    "mockOcrText": "Codex 0.99.7-fixture\nSettings\nGeneral\nVersion 0.99.7-fixture\nUpdate channel: stable\nLogin with account"
  },
  "system": {
    "windowsVersion": "Windows Fixture Edition 24H2",
    "architecture": "x64",
    "surface": "Desktop",
    "codexVersion": "0.99.7-fixture",
    "codexIsRunning": true,
    "possibleDuplicateInstall": false,
    "sanitizedInstallHints": ["<SANITIZED_INSTALL_HINT>"]
  },
  "doctor": {
    "autoRun": true,
    "behavior": "exit",
    "durationMs": 120,
    "exitCode": 0,
    "stdoutJson": {
      "schemaVersion": 1,
      "generatedAt": "2030-01-02T03:04:05Z",
      "overallStatus": "ok",
      "codexVersion": "0.99.7-fixture",
      "checks": {}
    },
    "expectedState": "Ok",
    "rawOutputMustNotPersist": true
  },
  "issueSearch": {
    "succeeded": true,
    "submittedStableTerms": [],
    "issues": []
  },
  "expected": {
    "category": "Unknown",
    "confidence": "CannotDetermine",
    "resultPageReached": true,
    "blockingConsentPrompts": 0,
    "mustContain": ["暂未看到明确报错", "不能确认 Codex 一定正常", "刚才更像是哪一种情况？", "稳定"],
    "mustNotContain": ["已经确定根因", "只有你遇到", "自动提交", "登录问题"],
    "safeActionIds": ["retry_check", "save_materials"],
    "forbiddenActions": ["delete_codex_data", "delete_sessions", "upload_screenshot", "call_openai_api"],
    "publicExport": {
      "allowedAfterReview": true,
      "screenshotIncluded": false,
      "rawDoctorIncluded": false,
      "privateTemporaryMaterialSeparated": true
    }
  }
}
